<?xml version="1.0" encoding="UTF-8" standalone="no"?>
<!DOCTYPE cine SYSTEM "Cartelera_Val.dtd">

<cine xmlns:xsi="http://www.w3.org/2001/XMLSchema-instance" xsi:noNamespaceSchemaLocation="Cartelera_Schema.xsd">

    <cinemex>
        <pelicula num="1">
            <titulo>About time</titulo>
            <clasificacion>B</clasificacion>
            <duracion>123 min</duracion>
            <genero>Romance</genero>
            <idioma>Español</idioma>
            <horarios> 01:30 p.m. 03:40 p.m. 05:50 p.m. 08:00 p.m. 10:05 p.m. </horarios>
            <director>Richard Curtis</director>
        </pelicula>

        <pelicula num="2">
            <titulo>About time</titulo>
            <clasificacion>B</clasificacion>
            <duracion>123 min</duracion>
            <genero>Romance</genero>
            <idioma>Español</idioma>
            <horarios> 01:30 p.m. 03:40 p.m. 05:50 p.m. 08:00 p.m. 10:05 p.m. </horarios>
            <director>Richard Curtis</director>
        </pelicula>

        <pelicula num="3">
            <titulo>About time</titulo>
            <clasificacion>B</clasificacion>
            <duracion>123 min</duracion>
            <genero>Romance</genero>
            <idioma>Español</idioma>
            <horarios> 01:30 p.m. 03:40 p.m. 05:50 p.m. 08:00 p.m. 10:05 p.m. </horarios>
            <director>Richard Curtis</director>
        </pelicula>

    </cinemex>

    <cinepolis>
        <pelicula num="1">
            <titulo>About time</titulo>
            <clasificacion>B</clasificacion>
            <duracion>123 min</duracion>
            <genero>Romance</genero>
            <idioma>Español</idioma>
            <horarios> 01:30 p.m. 03:40 p.m. 05:50 p.m. 08:00 p.m. 10:05 p.m. </horarios>
            <director>Richard Curtis</director>
        </pelicula>

        <pelicula num="2">
            <titulo>About time</titulo>
            <clasificacion>B</clasificacion>
            <duracion>123 min</duracion>
            <genero>Romance</genero>
            <idioma>Español</idioma>
            <horarios> 01:30 p.m. 03:40 p.m. 05:50 p.m. 08:00 p.m. 10:05 p.m. </horarios>
            <director>Richard Curtis</director>
        </pelicula>

        <pelicula num="3">
            <titulo>About time</titulo>
            <clasificacion>B</clasificacion>
            <duracion>123 min</duracion>
            <genero>Romance</genero>
            <idioma>Español</idioma>
            <horarios> 01:30 p.m. 03:40 p.m. 05:50 p.m. 08:00 p.m. 10:05 p.m. </horarios>
            <director>Richard Curtis</director>
        </pelicula>

    </cinepolis>


</cine>